[
  {
    "research_status": "verified",
    "company": {
      "display_name": "Abea Anatoli",
      "legal_name": "Abea Anatoli",
      "organization_type": "mixed",
      "founded_year": null,
      "ownership_model": "private_company",
      "employee_count_range": null,
      "website_url": "https://www.abea.gr",
      "country_code": "GR",
      "headquarters_city": "Chania",
      "headquarters_region": "Crete",
      "headquarters_latitude": 35.5138,
      "headquarters_longitude": 24.018,
      "summary": "Abea Anatoli is a curated Greek olive oil supplier based in Chania, Crete. The profile combines company website evidence with local directory ingestion for the first Foodbase olive-oil pilot.",
      "priority_tier": 1
    },
    "market_presence": {
      "serves_greece": true,
      "regions_in_greece": [
        "Crete"
      ],
      "export_markets": [],
      "supported_languages": [],
      "channels": [],
      "export_license_status": "unknown",
      "export_license_notes": null
    },
    "stage_coverage": [
      "agricultural_production",
      "primary_processing",
      "packaging"
    ],
    "offerings": [
      {
        "name": "Olive Oil",
        "product_category_slug": "olive-oil",
        "subcategory": "Cretan Olive Oil",
        "variety_or_cultivar": null,
        "offering_type": "finished_product",
        "product_tags": [
          "olive oil"
        ],
        "packaging_formats": [],
        "stage_coverage": [
          "agricultural_production",
          "primary_processing",
          "packaging"
        ],
        "private_label_supported": null,
        "notes": "Curated from local scrape evidence for the Foodbase olive-oil pilot."
      }
    ],
    "capabilities": [],
    "certifications": [],
    "geographical_indications": [],
    "facilities": [
      {
        "facility_type": "head_office",
        "name": "Abea Anatoli headquarters",
        "city": "Chania",
        "region": "Crete",
        "address": null,
        "latitude": 35.5138,
        "longitude": 24.018,
        "temperature_zones": [],
        "notes": null
      }
    ],
    "contacts": [
      {
        "contact_type": "email",
        "label": "General",
        "value": "abea@abea.gr",
        "is_primary": true
      },
      {
        "contact_type": "phone",
        "label": "Main",
        "value": "2821096071",
        "is_primary": true
      },
      {
        "contact_type": "website",
        "label": "Website",
        "value": "https://www.abea.gr",
        "is_primary": true
      }
    ],
    "capacity_profiles": [
      {
        "capacity_scope": "organization",
        "capacity_kind": "available_capacity",
        "minimum_order_quantity": "On request",
        "notes": "Public capacity figures were not disclosed in the source material."
      }
    ],
    "commercial_terms": {
      "minimum_order_quantity": "On request",
      "lead_time": "On request",
      "sample_policy": null,
      "incoterms": []
    },
    "public_data_gaps": [
      "Exact production volume",
      "Spare capacity by harvest year",
      "Lead time by packaging format",
      "Minimum order quantity by SKU"
    ],
    "sources": [
      {
        "url": "https://www.abea.gr",
        "source_type": "official_website",
        "title": null,
        "notes": "Primary company website."
      },
      {
        "url": "https://madeingreece.com/food-companies/",
        "source_type": "trade_directory",
        "title": null,
        "notes": "Directory evidence from madeingreece."
      }
    ],
    "notes": "Olive-oil pilot record generated from the merged scrape dataset."
  },
  {
    "research_status": "verified",
    "company": {
      "display_name": "Afoi I Foufa Ae",
      "legal_name": "Afoi I Foufa Ae",
      "organization_type": "mixed",
      "founded_year": null,
      "ownership_model": "private_company",
      "employee_count_range": null,
      "website_url": "https://www.foufas-oliveoil.gr",
      "country_code": "GR",
      "headquarters_city": "Tripoli",
      "headquarters_region": "Peloponnese",
      "headquarters_latitude": 37.5089,
      "headquarters_longitude": 22.3794,
      "summary": "Afoi I Foufa Ae is a curated Greek olive oil supplier based in Tripoli, Peloponnese. The profile combines company website evidence with local directory ingestion for the first Foodbase olive-oil pilot.",
      "priority_tier": 1
    },
    "market_presence": {
      "serves_greece": true,
      "regions_in_greece": [
        "Peloponnese"
      ],
      "export_markets": [],
      "supported_languages": [],
      "channels": [],
      "export_license_status": "unknown",
      "export_license_notes": null
    },
    "stage_coverage": [
      "agricultural_production",
      "primary_processing",
      "packaging"
    ],
    "offerings": [
      {
        "name": "Olive Oil",
        "product_category_slug": "olive-oil",
        "subcategory": "Extra Virgin Olive Oil",
        "variety_or_cultivar": null,
        "offering_type": "finished_product",
        "product_tags": [
          "olive oil"
        ],
        "packaging_formats": [],
        "stage_coverage": [
          "agricultural_production",
          "primary_processing",
          "packaging"
        ],
        "private_label_supported": null,
        "notes": "Curated from local scrape evidence for the Foodbase olive-oil pilot."
      }
    ],
    "capabilities": [],
    "certifications": [],
    "geographical_indications": [],
    "facilities": [
      {
        "facility_type": "head_office",
        "name": "Afoi I Foufa Ae headquarters",
        "city": "Tripoli",
        "region": "Peloponnese",
        "address": null,
        "latitude": 37.5089,
        "longitude": 22.3794,
        "temperature_zones": [],
        "notes": null
      }
    ],
    "contacts": [
      {
        "contact_type": "email",
        "label": "General",
        "value": "foufasg@otenet.gr",
        "is_primary": true
      },
      {
        "contact_type": "phone",
        "label": "Main",
        "value": "2755041031",
        "is_primary": true
      },
      {
        "contact_type": "website",
        "label": "Website",
        "value": "https://www.foufas-oliveoil.gr",
        "is_primary": true
      }
    ],
    "capacity_profiles": [
      {
        "capacity_scope": "organization",
        "capacity_kind": "available_capacity",
        "minimum_order_quantity": "On request",
        "notes": "Public capacity figures were not disclosed in the source material."
      }
    ],
    "commercial_terms": {
      "minimum_order_quantity": "On request",
      "lead_time": "On request",
      "sample_policy": null,
      "incoterms": []
    },
    "public_data_gaps": [
      "Exact production volume",
      "Spare capacity by harvest year",
      "Lead time by packaging format",
      "Minimum order quantity by SKU"
    ],
    "sources": [
      {
        "url": "https://www.foufas-oliveoil.gr",
        "source_type": "official_website",
        "title": null,
        "notes": "Primary company website."
      },
      {
        "url": "https://madeingreece.com/food-companies/",
        "source_type": "trade_directory",
        "title": null,
        "notes": "Directory evidence from madeingreece."
      }
    ],
    "notes": "Olive-oil pilot record generated from the merged scrape dataset."
  },
  {
    "research_status": "verified",
    "company": {
      "display_name": "Afoi I Kalogirou Ae",
      "legal_name": "Afoi I Kalogirou Ae",
      "organization_type": "mixed",
      "founded_year": null,
      "ownership_model": "private_company",
      "employee_count_range": null,
      "website_url": "https://www.kalogirosolives.com",
      "country_code": "GR",
      "headquarters_city": "Volos",
      "headquarters_region": "Thessaly",
      "headquarters_latitude": 39.361,
      "headquarters_longitude": 22.9422,
      "summary": "Afoi I Kalogirou Ae is a curated Greek olive oil supplier based in Volos, Thessaly. The profile combines company website evidence with local directory ingestion for the first Foodbase olive-oil pilot.",
      "priority_tier": 1
    },
    "market_presence": {
      "serves_greece": true,
      "regions_in_greece": [
        "Thessaly"
      ],
      "export_markets": [],
      "supported_languages": [],
      "channels": [],
      "export_license_status": "unknown",
      "export_license_notes": null
    },
    "stage_coverage": [
      "agricultural_production",
      "primary_processing",
      "packaging"
    ],
    "offerings": [
      {
        "name": "Olive Oil",
        "product_category_slug": "olive-oil",
        "subcategory": "Extra Virgin Olive Oil",
        "variety_or_cultivar": null,
        "offering_type": "finished_product",
        "product_tags": [
          "olive oil"
        ],
        "packaging_formats": [],
        "stage_coverage": [
          "agricultural_production",
          "primary_processing",
          "packaging"
        ],
        "private_label_supported": null,
        "notes": "Curated from local scrape evidence for the Foodbase olive-oil pilot."
      }
    ],
    "capabilities": [],
    "certifications": [],
    "geographical_indications": [],
    "facilities": [
      {
        "facility_type": "head_office",
        "name": "Afoi I Kalogirou Ae headquarters",
        "city": "Volos",
        "region": "Thessaly",
        "address": null,
        "latitude": 39.361,
        "longitude": 22.9422,
        "temperature_zones": [],
        "notes": null
      }
    ],
    "contacts": [
      {
        "contact_type": "email",
        "label": "General",
        "value": "kalogirosolives@gmail.com",
        "is_primary": true
      },
      {
        "contact_type": "phone",
        "label": "Main",
        "value": "2425022990",
        "is_primary": true
      },
      {
        "contact_type": "website",
        "label": "Website",